{
  "$schema": "https://wellmanifest.dev/schemas/dsl-manifest/v1",
  "schema": "wellmanifest.dsl/manifest/v1",
  "id": "wellmanifest.dsl.profiles",
  "name": "Wellmanifest reusable DSL profiles",
  "version": "0.2.0-dev",
  "status": "experimental",
  "purpose": "Closed reusable data contracts and deterministic composition policy for independently governed DSLs",
  "domain": "dsl-governance",
  "owners": [
    {
      "kind": "repository",
      "id": "github:wellmanifest/dsl",
      "responsibilities": [
        "semantics",
        "validation",
        "compatibility",
        "runtime",
        "security"
      ]
    }
  ],
  "source": {
    "repository": "https://github.com/wellmanifest/dsl",
    "path": "profiles/wellmanifest-profiles.schema.json",
    "declaredVersion": "1",
    "canonical": "json-ast",
    "mediaType": "application/schema+json",
    "selectors": []
  },
  "ownedPaths": [
    "profiles/dsl-manifest.json",
    "profiles/**",
    "docs/**",
    "examples/profiles/**",
    "schemas/dsl-manifest.schema.json",
    "schemas/commands/**",
    "spec/DSL_STANDARD.md",
    "src/dsl_check.py",
    "tests/profile_contract_test.py"
  ],
  "artifacts": [
    {
      "path": "profiles/wellmanifest-profiles.schema.json",
      "role": "normative-source",
      "digest": "sha256:b607058a8dd2b762002db812472b9e227e520d9820d2d52f89ce586791b9a819"
    },
    {
      "path": "schemas/dsl-manifest.schema.json",
      "role": "schema",
      "digest": "sha256:d128a2cab0459fab91788a062875242dc5cfd62fd9f37cab49c8adb42b28901d"
    },
    {
      "path": "schemas/commands/validate.schema.json",
      "role": "schema",
      "digest": "sha256:51d7022d1bafcf3256838cd11c97bef8ce443962b7b138fcdd5949669b6e49bf"
    },
    {
      "path": "schemas/commands/generate.schema.json",
      "role": "schema",
      "digest": "sha256:68c1f8fca66bd16c50eb92e708f6c4003c2c1732e16a225b7b0b870567b3d673"
    },
    {
      "path": "schemas/commands/patch.schema.json",
      "role": "schema",
      "digest": "sha256:32a88614cf5861506ae87f00c8eb4286bc4f8285be43ffa61436982036c0097a"
    },
    {
      "path": "schemas/commands/query.schema.json",
      "role": "schema",
      "digest": "sha256:812c755a92e6b4a945dcc1d63bf2d5967acae09577f2945925f7432cdf72165c"
    },
    {
      "path": "schemas/commands/resolve.schema.json",
      "role": "schema",
      "digest": "sha256:f1e68cba469cafb7d3299bb2300b6d7ce4ca028bfec216eac3ba64af67d554b4"
    },
    {
      "path": "spec/DSL_STANDARD.md",
      "role": "documentation",
      "digest": "sha256:ed53c9229321226aef867567f1a14c656a3c1bb0fc1f993ea4397e183c38acd6"
    },
    {
      "path": "docs/GRAMMAR_TOOLCHAINS.md",
      "role": "documentation",
      "digest": "sha256:e1535e86bec5f71b1a737e3e0f7f2f1099469c21d293a6e7f7579a8faef68f92"
    },
    {
      "path": "docs/EXECUTION_RECOVERY_PROFILES.md",
      "role": "documentation",
      "digest": "sha256:41e5e40973f9413e922afca46103e3bb78b2d8278de8554e6927c13e8989750f"
    },
    {
      "path": "examples/profiles/valid/execution-recovery.json",
      "role": "example",
      "digest": "sha256:dbc8cc45386bcc1e6780ae9e134dd50316f84463bc471d3c0ed7991c036669f9"
    },
    {
      "path": "examples/profiles/invalid/execution-recovery.json",
      "role": "example",
      "digest": "sha256:4e56637a34d8af87355c922660247309c85f583c02cfdc61bdbc060f2bb8a002"
    },
    {
      "path": "tests/profile_contract_test.py",
      "role": "parser-contract",
      "digest": "sha256:0395e17069237087a855985125fe2ca90b7717d90019bb76184c263bd905059c"
    },
    {
      "path": "src/dsl_check.py",
      "role": "parser-contract",
      "digest": "sha256:ffca42a99e940c0cb8c911c1ebb38f75eff33baa55e1240bce071aaf00c2660b"
    }
  ],
  "namespaces": [
    {
      "prefix": "wellmanifest",
      "uri": "https://wellmanifest.dev/"
    }
  ],
  "projections": [],
  "lifecycle": {
    "compatibility": "semver",
    "stability": "experimental",
    "breaking": "major",
    "additive": "minor",
    "fix": "patch"
  },
  "semantics": {
    "effectModel": "descriptive",
    "unknownPolicy": "preserve",
    "authoritySchema": null
  },
  "llm": {
    "mode": "none",
    "requestSchemas": [],
    "responseSchemas": [],
    "naturalLanguage": "forbidden",
    "sourceSchema": null,
    "decisionProtocol": "none",
    "modelAuthority": "none",
    "strict": true
  },
  "documentation": {
    "vocabularyKind": "documents",
    "commandRoot": "docs",
    "errorRoot": "docs/ERROR",
    "criticalRoot": "docs/CRITICAL",
    "commands": [],
    "errorCodes": [],
    "criticalCodes": []
  },
  "findingPolicy": {
    "schema": "wellmanifest.dsl/findings/v1",
    "requiredProducers": [
      "wellmanifest.dsl-check"
    ],
    "securityProducers": [
      "wellmanifest.dsl-check"
    ],
    "blockingSeverities": [
      "critical"
    ],
    "requireEvaluable": true,
    "blockUnresolvedSecurity": true
  },
  "publicationPolicy": {
    "declaredTier": "review",
    "deterministic": true,
    "independentReview": true,
    "externalAuthority": false,
    "runtimeIsolation": false
  },
  "conformance": {
    "levels": [
      "manifest",
      "contract",
      "runtime"
    ],
    "commands": [
      "python3 src/dsl_check.py validate profiles/dsl-manifest.json",
      "python3 src/dsl_check.py standards profiles/dsl-manifest.json",
      "python3 src/dsl_check.py self-test",
      "python3 tests/profile_contract_test.py"
    ],
    "validExamples": [
      "examples/profiles/valid/execution-recovery.json"
    ],
    "invalidExamples": [
      "examples/profiles/invalid/execution-recovery.json"
    ]
  },
  "mappings": [
    {
      "standard": "wellmanifest/new-project",
      "version": "0.18.0",
      "relation": "compatible-with",
      "uri": "https://github.com/wellmanifest/new-project"
    },
    {
      "standard": "wellmanifest/poa",
      "version": "0.1.0",
      "relation": "maps-to",
      "uri": "https://github.com/wellmanifest/poa"
    },
    {
      "standard": "wellmanifest/code-dsl",
      "version": "0.1.0-dev",
      "relation": "compatible-with",
      "uri": "https://github.com/wellmanifest/code-dsl"
    },
    {
      "standard": "wellmanifest/policy-dsl",
      "version": "0.1.0-dev",
      "relation": "compatible-with",
      "uri": "https://github.com/wellmanifest/policy-dsl"
    },
    {
      "standard": "wellmanifest/env-dsl",
      "version": "0.1.0-dev",
      "relation": "compatible-with",
      "uri": "https://github.com/wellmanifest/env-dsl"
    }
  ],
  "standardsLock": {
    "schema": "wellmanifest.standards-lock/v1",
    "entries": [
      {
        "standard": "wellmanifest.new-project",
        "version": "0.18.0",
        "repository": "https://github.com/wellmanifest/new-project",
        "revision": "769183ca27593af1d166acee11bc9e37decf9870",
        "contracts": [
          {
            "ref": "schema://wellmanifest.dev/new-project/governance/v2",
            "digest": "sha256:40b63b86b4503fe0c3801c93b315ec4c400795ea59b49834a4797787f01857c2"
          }
        ]
      },
      {
        "standard": "wellmanifest.poa",
        "version": "0.1.0",
        "repository": "https://github.com/wellmanifest/poa",
        "revision": "8424a7f5c977915ee08404b8b82d63e0f5e44ea2",
        "contracts": [
          {
            "ref": "https://github.com/wellmanifest/poa/blob/8424a7f5c977915ee08404b8b82d63e0f5e44ea2/standard/poa-process.schema.v1.json",
            "digest": "sha256:9222fbe9aded60df6d3c0b39b7a4a89b8ad627f122349e909fdfba44047669ab"
          },
          {
            "ref": "https://github.com/wellmanifest/poa/blob/8424a7f5c977915ee08404b8b82d63e0f5e44ea2/standard/poa-process.v1.gbnf",
            "digest": "sha256:d13d736cc3f4e07dd9366378183055ff0d9ad10dd4fc5bf1f322e2dc37d919ee"
          }
        ]
      },
      {
        "standard": "wellmanifest.code",
        "version": "0.1.0-dev",
        "repository": "https://github.com/wellmanifest/code-dsl",
        "revision": "6d27f5a9eef2be8fc7cfdbd12975dc57bc13778a",
        "contracts": [
          {
            "ref": "https://wellmanifest.com/schemas/code-dsl/v1",
            "digest": "sha256:ff782c1f5325d330fee22ed4805955c400c0a34655e8c2fb8082393aa497bf45"
          },
          {
            "ref": "https://wellmanifest.com/proto/code-dsl/v1",
            "digest": "sha256:43b8863cccf3efa6b83a3477e6d29c1e71720f5dfff1ea307c07b3b46894ff63"
          }
        ]
      }
    ]
  }
}
